Video Title,Channel Name,Published Date,Video ID,Video URL,Captions
Boring is not so boring anymore with Elon Musk #roughcopylearning #himanshuavasthi #theboringcompany,Rough Copy Learning,2024-09-04T10:39:40Z,eZX9AwX-QyM,https://www.youtube.com/watch?v=eZX9AwX-QyM,No captions found
"Elon Musk&#39;s $10,000 Tiny Home",TechKnowledgEE,2024-09-04T10:30:30Z,ouZEL7fCuJ4,https://www.youtube.com/watch?v=ouZEL7fCuJ4,"have you ever wondered what it's like to live in a tiny home Elon Musk did just that opting for a $10,000 prefab tiny house near SpaceX this decision reflects his minimalist lifestyle and a desire to focus on Innovation rather than material possessions the home made by boxable measures just 375 squ ft but is designed to be efficient and functional musk's choice is a stark contrast to his bu millionaire status as he prioritizes utility over luxury by living in this compact space he saves on costs and emphasizes sustainability this lifestyle Choice showcases his commitment to living simply while still pursuing groundbreaking ventures in technology and space exploration"
B0MBA - ELON MUSK LIBERA TODOS OS ARQUIVOS CONTRA MORAES,ALBERTO ,2024-09-04T10:29:04Z,vvbLb_xP6PU,https://www.youtube.com/watch?v=vvbLb_xP6PU,No captions found
Bầu cử Tổng thống Mỹ 2024: Tỷ phú Elon Musk ra cảnh báo &quot;nóng&quot; về tương lai nếu bà Harris đắc cử,Tạp chí VietTimes,2024-09-04T10:30:07Z,fGsy-sHENpA,https://www.youtube.com/watch?v=fGsy-sHENpA,No captions found
B0MBA - ELON MUSK LIBERA TODOS OS ARQUIVOS CONTRA MORAES,VLOG - O GIRO DE NOTÍCIAS ,2024-09-04T10:28:56Z,vJf9VELeWIU,https://www.youtube.com/watch?v=vJf9VELeWIU,No captions found
LIVE: Elon Musk Joins Trump in Fiery Debate with Kamala Harris,Tesla    ,2024-09-04T10:24:18Z,QS54tVNV3xk,https://www.youtube.com/watch?v=QS54tVNV3xk,Captions are disabled for this video
LIVE: Elon Musk Joins Trump in Fiery Debate with Kamala Harris,ذاكرة ماسبيرو,2024-09-04T10:22:54Z,AEnGW9dH5Bc,https://www.youtube.com/watch?v=AEnGW9dH5Bc,Captions are disabled for this video
LIVE: Elon Musk Joins Trump in Fiery Debate with Kamala Harris,Tesla     ,2024-09-04T10:18:36Z,Wa8KhrSyboQ,https://www.youtube.com/watch?v=Wa8KhrSyboQ,Captions are disabled for this video
KAMALA ANUNCIA BLOQUEIO DO TWITTER NOS EUA E ELON MUSK SE APAVORA!!! B0LSONARO AVISADO DE PRlSÃO 7/9,Plantão Brasil,2024-09-04T10:15:00Z,4PVO7doTsOM,https://www.youtube.com/watch?v=4PVO7doTsOM,No captions found
"X empire Rebus of the day • Kunning rebu si,Elon musk game • Daily Combo #shorts #shortsvideo #short",Tokens Cards,2024-09-04T10:06:32Z,8ffWNoHhEqM,https://www.youtube.com/watch?v=8ffWNoHhEqM,No captions found
Elon Musk&#39;s AI Nightmare The Risk of an Overbearing AI Future #nextgenai #ai,AI Innovators Hub,2024-09-04T09:55:11Z,GIsGyXwwX_A,https://www.youtube.com/watch?v=GIsGyXwwX_A,when you look at you know when you've been talking for years about the need for regulation what is the scenario that really keeps you up at night I don't think the AI is going to try to destroy all Humanity but it might put us under strict controls and there's nonzero chance of of it going Terminator it's not 0% but it's I think it's a it's a small likelihood of of annihilating humanity but it's not zero we wanted that probility to be zero close to zero as possible of AI assuming control for the safety of all the humans and taking over all the all the Computing systems and weapon systems of Earth and effectively being like some sort of uber nny like let's say you're you know a m missw cont contestant hypothetically and you know you say what what do you want and I want world peace and it's like okay well the you know one way to achieve world peace is to take all the weapons away from the humans so they can no longer use them and and to punish any humans that engage in you know extr territorial activity
AI and the Future of Sustainability Elon Musk&#39;s Caution on AI Safety #ai #nextgenai,AI Innovators Hub,2024-09-04T09:49:14Z,L1mpBrsjnfg,https://www.youtube.com/watch?v=L1mpBrsjnfg,AI what will AI do I I I don't think we need AI to solve sustainability that is that is happening it might help us accelerate it but I think we should also be cautious about Ai and just make sure that as we develop AI that it is you know doesn't get out of control and and that that the AI helps make the future better for Humanity and that's something I know you're working quite a lot on I think we should be more worried about AI safety than we currently are yeah especially you know the the future Wars are really going to be and we're seeing a taste of that with in in Ukraine uh very much uh drone Wars mhm so if your drones are better than their drones then you would basically it's what'll happen
"Explosión en la Ionosfera. Elon Musk, con un Starship abrió un agujero de 2.000 km en la Ionosfera.",Plataforma para la Austeridad Nacional (P.A.N),2024-09-04T09:42:12Z,AImf0nKkUO0,https://www.youtube.com/watch?v=AImf0nKkUO0,No captions found
Me after robbing elon musk #money #horse,Deadly dose of memes,2024-09-04T08:51:34Z,V_BO3whlkJw,https://www.youtube.com/watch?v=V_BO3whlkJw,Captions are disabled for this video
Chinese Elon musk 😂🤣#short #memes #funny #memesreaction #comedy #viral #viralshorts #reactionvideo,The Multiverse By THB,2024-09-04T08:01:15Z,ULT61kuqwt4,https://www.youtube.com/watch?v=ULT61kuqwt4,if you cannot copy the brand then copy the owner Elon Musk China cannot copy Tesla if you're watching this on YouTube subscribe if you're watching this on Instagram follow bye
Elon Musk Revealed He Has 12 kids @BeAlphaX #youtubeshorts #shortsvideo #shorts,BeAlphaX,2024-09-04T07:00:26Z,S7tbEqktd5c,https://www.youtube.com/watch?v=S7tbEqktd5c,how many kids do you have now I I have uh 12 12 yeah so you're definitely doing your part what do you like about kids what do you like about your kids I mean there's there's an older batch and a younger batch so there quite quite a big difference our little ex who's over there he's the eldest of the youngest uh he's four and my my older boys are 20 and 17 turning 18 shortly so big big gap um so what did you like about having kids well I think kids are delightful um why what's delightful about cuz they get a bad rap man so what did you find delightful about them I mean I think you we all I mean most people vast majority of people are you know are going to love their kids and it's like a little little loved one yeah yeah that's a good deal and they also want to love you kids if you give them the chance oh they do they're the only people you'll ever meet in your life who want nothing more than to have the best possible relationship they could have with anyone with you that's a good deal that's a good deal
99 + missed cal elon musk #funny  #greenscreen #youtubeshorts #shorts #trendingshort #viralshort,DL丨FUSHIGUR〇,2024-09-04T06:45:01Z,fJXKtvsw2QI,https://www.youtube.com/watch?v=fJXKtvsw2QI,No captions found
Elon Musk: Visioner di Balik Revolusi Teknologi #kisahinspiratif #motivation #elonmusk,KisahPendekNow,2024-09-04T06:36:48Z,gMJTKYfyhKY,https://www.youtube.com/watch?v=gMJTKYfyhKY,No captions found
"ŞOK ELON MUSK İDDİASI. BU İŞARETLER HAYRA ALAMET DEĞİL. KAPADOKYA,KURSK VS. ERGÜN DİLER SESLİ MAKALE",sesli makalem,2024-09-04T06:32:13Z,2sH3EG3ze-Y,https://www.youtube.com/watch?v=2sH3EG3ze-Y,No captions found
Elon Musk Tesla Robotaxi Hollywood Scam,Chris Norlund,2024-09-04T06:23:32Z,HkLaV2TOCM4,https://www.youtube.com/watch?v=HkLaV2TOCM4,"hi friends this is Chris y welcome back to the channel so Elon Musk has got a new scam and he's planning it as we speak so you mean like you knew or just just another issue of the uh well there's always some sort of scam right but it but it's like it's like the plans are in motion so I want to give everyone a fair warning and also get your predictions as well so basically it revolves the robot taxi thing right um they announced the location I don't know a couple days ago it kind of caught brushed under the rug because we were talking about the whole Twitter X Brazil thing right and that which as you guys know this has been absolutely insane but um the new scam we'll talk about we'll talk about Twitter in a minute here is um they're going to do it at Warner Brothers Studio right so basically Hollywood studio they're going to announce this thing and um I I think it's all going to be fake I mean I'm not surprised but the way that they're doing it at a Hollywood studio like making it like a TV show like oh we have flying car they they probably could they probably could I I mean I wouldn't I wouldn't put it past them right you know cuz then they can they can Si you out the wires later and the people pushing the car um the funny thing is is like he's actually done a Hollywood studio announcement before um back when they did Solar City announcement and that ended up being a scam that was on true story guys The Desperate Housewives TV set oh so Elon was a desperate housewive right at that time and he was saying hey we got these great solar panels that was back in 2016 again end up being a scam and so it was very interesting that for his next scam the robot taxi he's doing at another Hollywood set um so basically U why would you do it at this particular place um it's a large like Studio Lot okay cuz I it's you know since they're picking such a big location they probably want to drive it around they're not legal and it looks real yeah if if they if they pick like the back lot or if they pick some sort of you know advertising it looks really good oh sure sure sure if if you pick the right set and you set it up right yeah it may actually look like your neighborhood so that part's kind of interesting right so they're kind of shooting like like a commercial shoot yeah in a way right but but the thing why and I want to point this out why it's why the the demonstration will be a little bit deceptive there was like a hacker person and they were sharing some data that Tesla is already sort of mapping out the area around the studio like extremely well cuz this is something that we've known about with their robotex before is like uh Elon Musk and the YouTubers who used their um that's the full driving thing they have a better experience than the regular person oh because the engineers like spend all their time making sure that like that area is mapped out and then also putting like kind of um I would to say like like like barriers or invisible walls like a track kind of thing so they're doing at a at a Hollywood studio it's not a realistic environment they're not street legal and they're trying to convince you that this thing works um the reason why I saying it's well I mean there minwise a scam but but one thing that t always does is they like push the stuff out to that's not ready and they pretend like it is yeah so actually Hyundai has a you know they're working on same technology but they still working on it maybe it will finish by next year well we're talking about a couple different things though okay so CU mentioned that Hyundai's got technology also right so there's two different there's two separate Technologies so one is basically the taxi type technology the other which Hyundai's working on and we saw we saw a demo of the thing we actually saw it right um the other one is the parking thing parking one yeah and so Tesla and this is I guess had another scam um Tesla saying hey guys we got this thing he's calling it ass or ass yeah I know it's it's it's a stupid thing most companies call it um you don't want to name your tech technology I guess evid El wants to name his technology as I think it means for auto summon service or something like that yeah even have that but I don't want yeah I name it ass U most other companies they call it auto valet valet S A little better but the basic just why I say it's kind of a scam and be careful on this thing again this stuff's not street legal you have a car that's driving around with no driver in it and so the way they get around it and all the Tesla stock promoters have been doing it is like hey guys go to like a Walmart parking lot or like a Costco parking lot and like I don't want to and like play with your car in the parking lot and I mean the problem is is like you're encouraging people to test this in public right yeah I mean it's private property but you're still in public and there could be kids running around or any kind of thing you know so and and I want to get your guys's thoughts on that so you know what do you what do you think about testing a beta technology with basically amateurs right these aren't you know professional and plus it's working only on those kind of Environ maybe not your neighborhood well cuz it has a line you know right okay that that's another point right yeah cuz cuz we talked about before in the channel the way the the tesas robot or self-driving thing is it needs lines to operate right if there's no lines the thing does very very poorly and that's something yeah yeah that that's actually a really good point yeah that yeah I saw the hyai know demonstrate their parking you the the auto auto parking so you push the number of the sh shopping mall you know the number it goes to there you understand it comes to you I see so we're talking about in terms of like how could you get this to work yeah so so I'm not against this technology right I'm I'm not I'm not against it I'm against like giving it to the public just to distest just makes Mak it works yeah you don't want to put stuff on the road that can hurt people but technology wise yeah I like I love that well okay in order to get in order to get any of this kind of stuff to work I think we all have to have it or none of us has it yep right so like like for example just for example let's say we all go to the shopping mall we get out of our car right and then you push the the number of the parking spot and everything drives like crazy crazy super slow and then you you go there but there is one caveat though so Tesla's technology is going to be different than H it's going to be inferior and I know the Tesla fan Boyles get that but it's just reality the hardware in the Teslas is camera only only camera no sensor no sensors yeah um because it it's too expensive to put in sensors so they they take it out and then they pretend like oh we don't need sensors it's just a cut cost right um because the problem with with if if you only go camera only if there's no lines anywhere it's no good right U if the camera gets dirty it's no good uh if the weather's raining snowing whatever again mult reasons it's it's no good so that's why you want you want sensors if if you had enough money you could put a ton of sensors in these things it work a lot better but then you know it might cost you $200,000 and it's it's not really practical right so I'm not I'm not completely against the parking stuff um but you know whether or not you know we get to the point to where everyone has it and and it's safe uh cuz one of the issues that's going to happen when you have a new technology and someone dies which is going to invariably happen at some point law after that yeah there'll be laws people like why did you let these things on the road you know people are going to be upset that that kind of stuff so I I think that's something that that's a big concern the other issue is going to be Insurance costs right uh someone in our community CU we have a really smart Community they said you will know when this technology is ready to when you put insurance on your car and the insurance companies option what's that there's option okay well one would be that option that there's for that right but the other one would be that the option would be like the insurance companies sort of rate it to where it's it's safer I see so so I give you a simple example so um for those you have car insurance you know this um if your car has like a like an auto tracking thing you can say my car comes with a Tracker and if someone seals it I I can track my car easier right so the insurance is like oh you got a Tracker we lower your insurance if if you tell the insurance company I have you know robot driving or whatever and the insurance company says that's a good thing and they lower your value right do you understand yeah that that that's based on statistics based on numbers if the insurance companies believe that the robots are safer and and they include that in policy I see right do you see what I'm saying then then then then we're ready for it yeah yeah yeah we're we're a long we're a long ways from that right you know these days if you tell insurance company you have it they they might raise it because too many people get hurt cuz they play with it the same way that the people playing with their you know ass system in the in the Costco in the Costco parking lot or you know and then that's why I go back to like Tesla's going to announce their their robot texi thing at the um what do you want to call it at the uh at at the the movie studio right so so it's a big problem the other thing we got to talk about is the Twitter situation so now just back to Twitter not a yeah I I showed y Ela must feed we usually don't look at it cuz it's just too much right yeah but one of the things he's like hey everyone in community do you still call it Twitter or X it's like stupid well the problem was actually I thought I thought the Twitter with like the bird logo and then and I send out tweets I thought that was a pretty good logo and a pretty good branding right so now like when you have X am I sending out X's I mean it's kind of weird to to say that right I don't I don't think anyone really knows cuz we still refer to his Twitter and and tweets yeah so you know whether or not they change it back that would be a really really interesting thing um they spent a bunch of money already yeah to to change the brand to change the brand you got to you know change the stationary and they they made like a new sign for the building sign new memo and new paper back yeah so but what would you do you made the mistake of changing from Twitter to X and so if you change it back everyone's going to make fun of you right he doesn't care right right I that's musy doesn't care so would you just change your back then I guess because it's better it is better I don't know he maybe people voting for tater he said oh I'm gonna you know follow you guys and you I'll bring you back to the trer the problem is whatever vote that he does it's always a fake vote anyway cuz he can have a bunch of bots vote on vote on said boat actually it's really funny you know Mark Cuban the um he's the guy on the the shk tank guy yeah yeah so he's in a he's in a fight with the they always figh about stupid stuff but um Mark cubin did a poll of like who do you think is going to win for president you knower Trump and then like the robotss all voted for Trump right and um Cuban pointed out he's like hey I have like 500,000 Impressions so Impressions like how many people see your post or whatever but then like a million people voted on the thing you see what I'm saying like it doesn't add up yeah that's right and and so then and then Mark T's like how many Bots do you have on this on on this platform so I mean I can just tell you guys I have an account on Twitter ask what you want to call it um I don't tweet anything I just use it just to to check on you know whatever people are doing I have like 80 robot followers and they're all hot girls and they all want to cuddle and every day there's like a new follower and the other thing that's kind of funny is um whatever you follow certain accounts there'll be like three copies of that account that follow you so not the it's just it's just filled with bots so you have you have that problem and then we Lo we looked at the feed they got a working on that what's that theer a well some of these even are um blue check marks yeah yeah so so that so that means like someone is paying to have a robot yeah yeah yeah right so there's been there's been question of like who's who's putting up the money to do it or is Elon mus just giving a bunch of robots blue check I mean I don't know they're not going to tell you right who knows I mean they they tell you a kind of crazy number they they always um it's his CEO CU I mean he's not actually the CEO cuz he stepped down but leis know she she released numbers recently and she's like guys we have like 30% Republican 30% Democrat 30% independent like that's what they said and I was just like how do you know because when you sign up for you know an account there you don't tell them you know which party you're in you don't you don't really know and plus they're all robots anyway so it it's it's it's really hard to say how many people real people are not real people are on there I mean I mean I don't think anybody really know and then and it's funny too because um uh from Elon mus point of view as long as he's got traffic as long as people are are or someone is paying him or whatever right you just don't know um and then then we looked at it and it's like remember the The Wall Street Journal said there was like 61 tweets a day right um we looked at it's real it's like like nonstop and and the recent one was was the big one was um he had tweeted out this weird thing where like Only You Know Rich white people oh men Rich right men you know should be able to vote yeah like like I mean I mean like well remember musk was born during a part in South Africa which is which is basically where know there his grandpa is super racist right yeah yeah and I made a video guys about that I I wish I was making that stuff up I I can't even repeat the stuff that his grandfather said uh cuz his actually his grandfather wrote a couple conspiracy theory books um his grandfather was against vaccines he was against all kinds of stuff he blamed it let just say this he get along with a certain group of people in Germany in 1940s cuz grandfather was it was that kind of conspiracy kind of person and then the stuff that he he'd write about um CU there's actually newspaper articles you can find it it's easy to find it's all public um he'd basically write about like you know I'm the owner of the plantation and my workers who have to be a certain kind of people you know and like I said it's it's kind of what You' expect from that kind of stuff so I can't I can't repeat this stuff so even though Elon mus didn't really know his grandfather I'm just to be honest he didn't really know his grandfather I guess uh his grandfather uh died when Elon was three Elon comes from just those kind of family that kind of family yeah yeah so you know one of the things that they all now he's saying those kind of things yeah yeah if he didn't say those kind of things then you you know you know you you know you don't have to be like your grandfather you don't have to be weird like your father um did I tell you about his father no his father had two kids oh yeah you're with his with stepter step but it's it's I know it sounds weird it's the father's has a stepdaughter and then the father has two kids with a step so basically I think what it was is like elon's Dad married some woman the woman had a daughter and then the dad like the daughter yeah divorc it with the mom and then has two kids with a daughter it's it's weird so but again like like like if Elon doesn't have Elon doesn't have to be like that but I mean you know Elon has like 12 kids with all sorts of people so anyway that's the Elon stuff I just wanted to share the latest scam with the robot taxi we talked about the um the parking driving thing I want to hear what your guys' thoughts on that and what do you think about the latest crazy stuff that Y is saying on Twitter anyway thanks for watching everyone and uh we'll catch you in the next video so bye"
Elon Musk की 9 आदतें | Success के लिए अपनाएं!🥰 #shorts #short #motivation #success #yt,Success Sikhlo,2024-09-04T05:45:03Z,w0JcDg48J2k,https://www.youtube.com/watch?v=w0JcDg48J2k,No captions found
Elon Musk Possui Das 3 Coisas Mais Caras,Sabe Curioso?,2024-09-04T05:30:36Z,74v3ryNX5xM,https://www.youtube.com/watch?v=74v3ryNX5xM,No captions found
ELON MUSK ; ARKADAŞIN KARAKTERSİZ İSE... #emlak #gayrimenkul #evrentug #seasons #satılık  #haber,ATEM EMLAK YOUTUBE KANALI (ORHAN KAŞIKÇI),2024-09-04T05:20:52Z,V0CMV23-cbE,https://www.youtube.com/watch?v=V0CMV23-cbE,the tests for assessing someone's character is to look at the character of their friends and their Associates while people can put up a mask themselves for their character their friends and Associates will not Y and so you can judge judge a person's character by their friends and Associates and to some degree by their enemies right if evil people hate you well you might be doing something right
