Video Title,Channel Name,Published Date,Video ID,Video URL,Captions
Elon Musk&#39;s EPIC RAP Dissing BTS!,Mcash,2024-09-04T13:00:20Z,MCTFtzmR8Sc,https://www.youtube.com/watch?v=MCTFtzmR8Sc,Elon Musk just made a rap this on BTS humans listen up I got words for the scene where the trans and the F ain't all what it seems got BTS on blast but this ain't about Fame it's about the message and who's to blame Jun cook yeah I'm calling the coward out by name you're pushing an agenda playing a dangerous game trans activist Vibes but think of the youth are they tools for your narrative your version of Truth you got kids confused thinking changes a trend but this ain't fashion it's life it's real my friend mutilation ain't a word to throw around light but here you are making day look like night you spread propaganda wrapped in K-pop beats but below the surface there's a mess of deceits children looking up seeing Stars not scars but you're leading them to question who they are
Elon Musk&#39;s Shocking $216 Million Parenting Bill  #wealthtransfer,Wealth Transfer 🤑,2024-09-04T13:00:02Z,0xkoYN_PLpI,https://www.youtube.com/watch?v=0xkoYN_PLpI,"but what if I told you Elon spends much more on his children yes he has nine kids running around while the average parent spends around $300,000 raising a child elon's kids are anything but average they attend private schools and travel in his private jet for vacations totaling about $1 million a year so this man is shelling out at least $24 million on just one of his kids multiply that by nine and you have a Bill of around $216 million that's expensive but Elon doesn't mind when he's buying Jets like their toys"
पीटर देगे Elon musk को झटका l Elon musk SpaceX l by rachit gautam #shorts,Rachit Gautam,2024-09-04T12:50:09Z,LZgC-iyblAM,https://www.youtube.com/watch?v=LZgC-iyblAM,No captions found
Elon Musk talks about morals  #elonmuskfan #elonmusk,ElonMusk,2024-09-04T12:51:09Z,H3NhkO0X6Yg,https://www.youtube.com/watch?v=H3NhkO0X6Yg,okay I mean I'm a big believer in moral absolutism not moral relativism there is there's good and bad in the absolute and you judge any group or individual against absolute moral standards not whether they they're the so-called oppressed or oppressor just on absolute moral terbs are they doing good things do they want to motor inent people that's bad doesn't matter who they are
Elon Musk Unveils &#39;Colossus&#39;—World&#39;s Largest Nvidia GPU Supercomputer Built in Just 3 Months,Suman iTTV,2024-09-04T12:40:03Z,IhnnIwlAD0I,https://www.youtube.com/watch?v=IhnnIwlAD0I,No captions found
GREATNESS ISN&#39;T ABOUT PERFECTION 🔥 By Elon Musk 😈 | #qoutes #shorts,Way to Success ,2024-09-04T12:30:11Z,AKyaOQawZDo,https://www.youtube.com/watch?v=AKyaOQawZDo,Captions are disabled for this video
"Just Happened! Elon Musk Announces Tesla Bot Optimus Next Gen 3 Securities, Durability &amp; Production!",TESLA CAR WORLD,2024-09-04T12:29:28Z,MsLvoZ1kqzU,https://www.youtube.com/watch?v=MsLvoZ1kqzU,"but we we expect to have several thousand Optimus robots um produced and doing useful things by the end of next year uh in the teses of factories and then in 2026 ramping up production quite a bit um and at that point we'll be providing Optimus robots to uh outside customers $580,000 is the amount of money a business can save over 20 years in labor cost by purchasing a security guard Tesla bot for 20 grand instead of hiring a human worker for $600,000 over this time imagine how much money you can save with your current company size actually deciding between humans and robots could be a complete GameChanger no benefits no vacations and no fatigue you don't have Healthcare injuries or workplace drama either Tesla bot can operate continuously replacing humans with savings up to 30 times cheaper so how is Tesla bot Superior and why does Elon Musk pursue it so persistently what is the expected lifespan of these robots when we talk about the Tesla bot we're looking at a robot that's built to last Elon and his Tesla team have focused on making a robot with an estimated lifespan of 15 to 20 years and this isn't just a number pulled out of thin air it's backed by careful design choices quality materials and advanced technology 20 years is an admirable number for a humanoid robot on the market today actually the atlas primarily designed for research and development has an expected lifespan of 5 to 10 years this is a bit shorter about four times less than the projected 20-year lifespan of the Tesla bot unry on the other hand produces a range of models including the unry H1 and G1 designed for various applications like research and entertainment the H1 model for example typically has a lifespan of 5 to 7 years with regular maintenance this is even shorter potentially half of what the atlas is and a full 15 years less than the 20-year lifespan Tesla aims to achieve with Tesla bot the great achievement of Tesla bot is the combination of many Advanced manufacturing and Technology factors that Tesla possesses Tesla uses durable materials like aluminum Alloys and composite Plastics in Tesla bot's construction these materials aren't just for show they're built to resist wear and tear ensuring that the bot stays working for years Tesla Bots equipped with a sophisticated control system that learns and adapts over time this system optimizes the Bots operations reducing mechanical wear and tear and minimizing the risk of breakdowns the result a robot that not only works better over time but also lasts longer moreover Tesla advancements in lithium ion battery technology are another GameChanger these batteries are intended to last longer and perform better minimizing the need for Replacements this contributes significantly to the overall lifespan of the Tesla bot every moving part of the bot Tesla's joints gears and Motors has been meticulously designed to withstand years of use this means fewer breakdowns and less need for maintenance allowing the bot to keep working for the Long Haul one more important thing is that Tesla's commitment doesn't end when the bot leaves the factory regular software updates improve improvements and address any issues ensuring your Tesla bot stays in tiptop shape throughout its life the 20-year lifespan of the Tesla B is a careful calculation based on the application of the most advanced technological resources and is the result of persistent research through rigorous testing by Elon and his team in today's Industries many robots are built to last between 10 and 15 years depending on their usage and maintenance for instance robots used in automotive manufacturing one of the most demanding environments often continue to operate effective ly for up to 15 years this is highlighting the potential longevity of highquality robotic systems in addition studies from respected institutions like the robotics Institute provide further backing they found that robots designed with strong durable materials combined with energy efficient systems and advanced automation can go for up to 20 years especially in industrial settings these findings give us a clear indication that with the right design of materials A robot's lifespan can be significantly extended the most concrete evidence comes from Tesla they already demonstrated its ability to extend the life of his products particularly in EVS through regular software updates and robust maintenance systems this same approach is being applied to Tesla bot continuous improvements throughout software updates means that the bot not only maintains its functionality but also improves over time this enables Tesla bot to not only work optimally but also ensure that it never becomes obsolete even if you bought it 20 years ago the design element cannot be ignored in this case Tesla's experience in creating long- lasting Vehicles directly in forms the design of the Tesla buot Tesla cars are expected to last 15 to 20 years thanks to the high quality materials and optimized engineering used in their construction Tesla bought benefits from the same level of craftsmanship and Engineering suggesting that it too is built to last for decades especially one of the key factors in Tesla bot's potential longevity is its battery Tesla spent years developing Advanced Battery Technology for its Vehicles resulting in batteries that last longer and perform better over time and that means Tesla Bots going to have fewer battery Replacements and a longer lifespan before Tesla bot hits the market it undergoes extensive testing including fatigue testing and durability assessments these tests are conducted in harsh conditions such as field tests at gigafactories component and system level tests mechanical and electrical testing and real world learning it ensures the bot can handle continuous operation for years without major hiccups this rigorous approach to testing gives us confidence that Tesla bot is designed to withstand the wear and tear of long-term use for anyone considering Tesla bot this long lifespan represents a solid return on investment and a reliable tool for the future how safe and secure is Tesla bot when talking Tesla bot Safety and Security are at the Forefront of the conversation Tesla's made it clear that they are committed to creating a humanoid robot that not only excels in performance but also prioritizes the safety security and the privacy of its users Tesla's equipped to Tesla bot nextg with an array of advanced safety features these include emergency stop mechanisms obstacle detection and sophisticated navigation systems that allow the bot to operate safely in various environments these systems are designed to prevent accidents and ensure that the bot can work alongside humans without posing a risk in comparison Boston Dynamics robots such as Atlas and spot are also equipped at Advance sensors and AI that enable them to navigate complex environment safely however Boston Dynamics tends to focus more on performance rather than emphasizing user safety to the same degree that Tesla does meanwhile unitri robots like the go1 and go2 include basic safety protocols like obstacle avoidance but they lack the level of sophisticated safety mechanisms that you have in the Tesla bot Tesla's renowned for its strong emphasis on user privacy and data security across its product ecosystem and that goes from Vehicles all the way to Digital Services the Tesla bot NextGen is expected to integrate Advanced encryption secure communication protocols and strict access controls to protect user data and prevent unauthorized access this focus on data security is crucial for users who are concerned about privacy in the age of smart technology in contrast to Boston Dynamics while leading in robot performance has not placed the same emphasis on user data security their robots are primarily designed for commercial and Industrial use where data privacy might not be as big a concern on the other hand unitary they also provide limited info on their data security measures and that could raise concerns for those of us who want privacy Tesla's approach to user control is another area where the Tesla bot stands up Tesla's likely to implement strong authentic iation and authorization mechanisms ensuring that only verified users can access or control the bot remotely and this minimizes the risk of unauthorized remote access which could compromise users or the safety of others Boston Dynamics robots some of which are used in military applications may offer more remote access capabilities which could present greater security risks while unry offers more affordable robots users may have to compromise on personal info security during use priced at around 16 Grand just $4,000 cheap than Tesla bot but the Gap in safety is Major despite the price difference is not so much Tesla's publicly committed to developing AI systems including Tesla bot with strong ethical principles this ethical framework is expected to lead the additional safeguards and oversight to protect user safety and prevent the misuse of the Tesla bot in contrast competing robotics companies like Boston Dynamics and unry have not made the same level of public commitment to ethical AI development this could result in fewer protections for users how does Tesla bot prevent crashes during operation Tesla bot is equipped with numerous redundant Safety Systems including emergency stop mechanisms for sensing joints and advanced sensor arrays these features enable the robot to immediately stop or safely deactivate in case of an unexpected event minimizing the risk of harm in contrast while Boston Dynamics and unitri robots also include safety mechanisms they're not as comprehensive or sophisticated as those found in Tesla bot Tesla's expertise in autonomous vehicle techn technology plays a crucial role in Tesla bot's ability to anticipate proactive accident protection prevents accidents this bot is capable of predicting and proactively responding to potential issues like detecting and avoiding obstacles or mitigating the impact of sudden movements this is a big advantage over Bots than Dynamics in unitri robots which tend to rely more on reactive safety measures that are less effective in fast changing situations Tesla poot has never been inferior to the modern Tesla EVS that consumers have experienced it's outfitted with a wide array of sensors including Imaging and distance sensors allowing it to detect its surroundings and adapt its actions in real time the resolution of Tesla bot similar to Tesla's FSD cameras with a resolution ranging from 1.2 to 1.3 megapixels comparable to cameras and liar sensors used in Atlas and unitary robots which are around 1 to 2 megapixels the field of view of Tesla bot is possibly around 120 to 150° covering a large surrounding area this is 1.6 times wider than unitary robots which typically have a narrow Earth fov of around 90 to 120° this level of sensor integration provides Tesla b a significant advantage in maintaining stability and avoiding accidents particularly in complex environments Boston Dynamics Atlas which is also sensor rich is primarily designed for controlled environments and might struggle in more unpredictable settings unitri H1 being lighter and less equipped may find it challenging to handle emergency situations effectively the advanced Control software in test Tesla bot enables quick decision making in emergency scenarios when an issue is detected Tesla bot can swiftly transition to safety mode either slowing down or stopping entirely to protect both itself and its surroundings while Atlas has similar capabilities its response times in critical situations might not be as fast as Tesla bot unitri H1 with its more basic safety protocols might not react as effectively in emergencies potentially increasing the risk of accidents Tesla bot also excels in remote monitoring and control allowing operators to intervene quickly and safely from a distance if necessary this feature enhances the robot's ability to manage unexpected situations in real time reducing the likelihood of crashes in comparison Boston Dynamics and unry robots may not offer the same level of advanced remote control making it harder to respond to sudden issues what is the development plan for the Tesla bot do think we will have Optimus um and limited production in the factory in the actual Factory itself doing useful tasks before the end of this year I think we we may be able to sell it externally by the end of next year as of now Tesla has taken a significant step by beginning the development of custom actuators for Tesla bot Tesla constructed approximately five or six units of Tesla bot these initial units are being fine-tuned to ensure that they meet the high standards required for mass production this phase is crucial as it allows Tesla to identify and resolve any potential issues before scaling and production looking ahead Elon suggested that mass production and delivery of the Tesla bot could start as early as is next year a key milestone in this timeline is the integration of the first actuators by November this sets the stage for a broader roll out the following year this change also reflects the need for additional upgrades such as improved movement enhanced hands speech capabilities and advanced AI but we we expect to have several thousand Optimus robots um produced and doing useful things by the end of next year uh in the tesel factories and then in 2026 wrapping up production quite a bit um and at that point we'll be providing Optimus robots to uh outside customers by 2026 Tesla aims to ramp up production significantly and start mass production and offer Tesla bot robots to external customers making a major expansion of their robotics division Tesla's approach to tesotf uses on the combination of powerful AI within humanoid robot design the company's development process is known for bold claims and high-profile announcements which sometimes lead to skeptic ISM about meeting release dates however Tesla's focus on versatility is consistent with their broader mission in Ai and automation using Tesla bot internally is a strategic move for Tesla it helps perfect the robot's functionality while improving Factor efficiency and reducing labor costs this strategy mirrors Tesla's earlier approach with EVS where initial units were delivered to internal employees before public sales comparison with Boston Dynamics while Tesla's pushing forward with its ambitious plans Boston Dynamics has a different approach Boston Dynamics prioritizes Advanced Dynamic movement capabilities in their robots such as spot and stretch however however boson the Dynamics tends to focus more on specific applications rather than developing a broad general purpose humanoid robot like Tesla Tesla Bots designed with commercialization in mind aimed at mass production with Eline indicating a Target price under $220,000 this contrast with Assa which is primarily a research tool not intended for commercial sale Tesla developed Tesla bot rapidly from conception to functional prototypes in a pretty short time conversely Boston Dynamics often has a slower roll out their robots have longer development Cycles Boston Dynamics has spent years improving Atlas aided by alliances like DARPA to acquire its present degree of dexterity and Mobility the cautious approach contrasts with tesa's more aggressive timeline to ensure Telsa bot is as widely adopted as soon as possible while Atlas demonstrates outstanding athletic abilities like dancing backflipping and vaulting Tesla bot prioritizes practicality in everyday tasks Tesla's Ro robot runs on AI like their cars promising efficiency through a day's work on a single charge in contrast atlas's high-powered hydraulic actuators though powerful limit its operational time due to the battery consumption Tesla bought boasts more human life features including hands with five fingers and opposable thumbs aimed at performing a bunch of different tasks this is part of Tesla's ambition to make robots that closely mimic human capabilities although achieving this level of Dexter ity remains a significant challenge in conclusion depending on the purpose of use the owner will have the most suitable Choice Tesla bot is geared towards affordability and mass production focusing on tasks that can integrate into human environments and workplaces Boston Dynamics Atlas however remains a high performance research platform showing the outer limits of robotic mobility and physical capabilities the real world utility cost Effectiveness and integration into human activities will be crucial factors in comparing these robots performance and impact are you satisfied with Tesla bot's security features and how does its 20-year lifespan fit the needs of your home or business we'd be happy if you leave some thoughts about this down there in the comments and we hope you'll experience the utmost relaxation after watching this episode if you did we humbly ask that you press that like button and subscribe to the Tesla car World Community by joining our Channel just hit the Bell notification icon and that way you'll stay tuned for any fantastic videos coming your way your feedback down there and your likes on the video are very very much appreciated thank you so much for watching on behalf of the voiceover artist the script writer the video editor and the Tesla car world team we thank you for watching and hope to see you back here soon until then take care and God bless goodbye [Music] [Music] [Music] [Music]"
* Elon musk * x empire * airdrop listing date | x empire 30 September airdrop Claim now #xempire,Haqeer official Tech ,2024-09-04T12:21:33Z,_yJv7Hk5Wvw,https://www.youtube.com/watch?v=_yJv7Hk5Wvw,No captions found
7 de Setembro: Elon Musk impulsiona publicações para ato contra Moraes l O POVO NEWS,O POVO,2024-09-04T12:21:07Z,XIgGa8B0sm0,https://www.youtube.com/watch?v=XIgGa8B0sm0,No captions found
The Dark Side of Elon Musk’s Ambitions | Secrets Behind Elon Musk’s Success | Discovery2.O,Discovery2.O,2024-09-04T12:18:37Z,B0dAychIi70,https://www.youtube.com/watch?v=B0dAychIi70,Elon Musk is no ordinary entrepreneur and this is no ordinary story on one hand musk's journey is one of the most a inspiring Tales of our time how a man with Relentless ambition and vision transformed multiple industries from electric vehicles to space travel and became one of the most influential figures in the world but there's also a very dark story here how the man who promised to revolutionize the future has been surrounded by controversies lawsuits and allegations of unethical Behavior
"Starlink, de Elon Musk, recua e diz que vai bloquear. PIB do Brasil 3,3% em um ano . Eleição em SP",Reis do YouTube ,2024-09-04T12:09:25Z,Zw77YB-G9BI,https://www.youtube.com/watch?v=Zw77YB-G9BI,No captions found
"If you could buy anxiety, I&#39;d be richer than Elon Musk and Jeff Bezos combined #memes #memesdaily",Go byou (五秒),2024-09-04T11:49:32Z,3msaEwxriuc,https://www.youtube.com/watch?v=3msaEwxriuc,I get anxiety when you're not here with me I get anxxiety
LIVE: Elon Musk Backs Trump in Fiery Debate with Kamala Harris,Arham Ayurved by Dr. Smita Bora,2024-09-04T11:48:53Z,L8oepI3w-vw,https://www.youtube.com/watch?v=L8oepI3w-vw,Captions are disabled for this video
LIVE: Elon Musk Joins Trump in Fiery Debate with Kamala Harris,Tesla US,2024-09-04T11:39:54Z,wRDgxkfC1t0,https://www.youtube.com/watch?v=wRDgxkfC1t0,Captions are disabled for this video
How Insane is Elon Musk? 💫💫,Rise With Pawan,2024-09-04T11:30:34Z,u5vudgEdfWQ,https://www.youtube.com/watch?v=u5vudgEdfWQ,how much of your personal Fortune have you poured into this uh $100 million $100 million into something that you did not believe would work at the beginning yes oddly coming into the rocket business not knowing anything about Rockets not having ever built anything I mean um I would have to be insane if I thought the ODS are in my favor why even began when something is important enough you do it even though flogs are not in your favor
Nitin Gadkari&#39;s Bold Response to Elon Musk on Tesla&#39;s Import Duty Concerns,Sigma Rules,2024-09-04T11:30:06Z,CB-cmeaYPpU,https://www.youtube.com/watch?v=CB-cmeaYPpU,if the musk is ready to manufacture a TX in India there is no problem we have got the all competency the vendors are available we have got the all type of technology and because of that he can reduce the cost but our request to him is that you come to India start manufacturing here India is a huge Market the export availability everything ports are available they can make their export from India and he is welcome he is welcome in India we don't have any problem but suppose he want to manufacture in China and sail in India it can not be a good proposition for India our request to him is come to India and manufacture you
BE LIKE ELON MUSK 🔥😈 | #shorts #quotes #trending #sigma #billionaire #attitude #edit #motivation,Wellness Bytes-1M,2024-09-04T11:28:54Z,NSIn--cdkDg,https://www.youtube.com/watch?v=NSIn--cdkDg,No captions found
Lula Critica Elon Musk!!!,Tentando Entender...,2024-09-04T11:22:07Z,BmS3wUIKnQM,https://www.youtube.com/watch?v=BmS3wUIKnQM,No captions found
"RCC News 7h |04/09| Starlink, de Elon Musk, recua e diz que vai bloquear acesso ao X no Brasil",Jovem Pan Maringá,2024-09-04T11:21:03Z,bDAxh-4bolE,https://www.youtube.com/watch?v=bDAxh-4bolE,No captions found
I got richer than Elon musk,HHP,2024-09-04T11:21:08Z,057I45A2J84,https://www.youtube.com/watch?v=057I45A2J84,Captions are disabled for this video
&quot;The Real Reason Elon Musk Wants Us on Mars! 🌍🔥&quot; #mars,Narrative Insights,2024-09-04T11:14:58Z,AoUWiHIme4U,https://www.youtube.com/watch?v=AoUWiHIme4U,did you know Elon Musk wants to make life on Mars for several big reasons first he believes it's crucial for Humanity survival as having a backup plan on another planet could protect us from existential threats he's also driven by a passion for exploration and the chance to inspire people with groundbreaking achievements plus the technological advancements needed for Mars could revolutionize various fields on Earth finally musk sees Mars as a potential hub for new economic opportunities and industries his vision for Mars reflects both a quest for survival and a deep curiosity about the cosmos if you like this video don't forget to like And subscribe for more
MORAES EXPOSTO EM ALEXANDRE FILES - ELON MUSK AFIRMA QUE GOVERNO BRASILEIRO SOFRERÁ CONSEQUÊNCIAS,Hype Universal,2024-09-04T11:13:00Z,wIlAcX_Hp5M,https://www.youtube.com/watch?v=wIlAcX_Hp5M,No captions found
💣ELON MUSK PÕE CARGO DE XANDÃO EM XEQUE E EXPÕE FRAGILIDADE DA JUSTIÇA BRASILEIRA | Enzuh Reacts,ENZUH,2024-09-04T11:00:52Z,sM8_O5_2NIM,https://www.youtube.com/watch?v=sM8_O5_2NIM,No captions found
